{
  "$schema": "https://json-schema.org/draft/2020-12/schema",
  "$id": "site-qa-audit/finding.schema.json",
  "title": "site-qa-audit findings.json",
  "description": "Файл находок прогона. Находки субагентов и плагинов приводятся к этому формату; id и fingerprint проставляет оркестратор (fingerprint.py compute).",
  "type": "object",
  "required": [
    "run",
    "findings"
  ],
  "properties": {
    "run": {
      "type": "object",
      "required": [
        "id",
        "site",
        "depth",
        "mode"
      ],
      "properties": {
        "id": {
          "type": "string",
          "description": "<YYYY-MM-DD>-<host>"
        },
        "site": {
          "type": "string"
        },
        "depth": {
          "enum": [
            "smoke",
            "standard",
            "deep"
          ]
        },
        "mode": {
          "enum": [
            "live",
            "dry-run"
          ]
        },
        "started_at": {
          "type": "string"
        },
        "finished_at": {
          "type": "string"
        }
      }
    },
    "not_checked": {
      "type": "array",
      "description": "Что не проверено и почему (запрет, авторизация, браузер, плагин, внешняя ссылка)",
      "items": {
        "type": "object",
        "required": [
          "what",
          "reason"
        ],
        "properties": {
          "what": {
            "type": "string"
          },
          "reason": {
            "type": "string"
          },
          "rule": {
            "type": [
              "string",
              "null"
            ],
            "description": "id правила url_guard, если причина — запрет"
          },
          "direction": {
            "type": "string"
          }
        }
      }
    },
    "findings": {
      "type": "array",
      "items": {
        "$ref": "#/$defs/finding"
      }
    },
    "rechecks": {
      "type": "array",
      "description": "Перепроверка заявленных исправлений (claims.py plan → результат): таблица «№, статус, чем проверено» в report.md",
      "items": {
        "type": "object",
        "required": [
          "repo",
          "number"
        ],
        "properties": {
          "repo": {
            "type": "string"
          },
          "number": {
            "type": "integer"
          },
          "title": {
            "type": "string"
          },
          "quote": {
            "type": "string"
          },
          "status": {
            "enum": [
              "FIXED-OK",
              "FIXED-INSUFFICIENT",
              "REGRESSION",
              "NOT-CHECKED",
              null
            ]
          },
          "reason": {
            "enum": [
              "logout-required",
              "other-account-type",
              "forbidden",
              "steps-unclear",
              "environment",
              "other",
              null
            ]
          },
          "reason_text": {
            "type": "string"
          },
          "checked_by": {
            "type": "string",
            "description": "Чем проверено: шаги, устройство, скриншот"
          },
          "finding_id": {
            "type": [
              "string",
              "null"
            ]
          }
        }
      }
    }
  },
  "$defs": {
    "finding": {
      "type": "object",
      "required": [
        "id",
        "direction",
        "check_id",
        "type",
        "severity",
        "title",
        "url",
        "sources"
      ],
      "properties": {
        "id": {
          "type": "string",
          "pattern": "^F-\\d{3,}$",
          "description": "F-001…, уникален в прогоне"
        },
        "fingerprint": {
          "type": "string",
          "pattern": "^[0-9a-f]{16}$"
        },
        "direction": {
          "enum": [
            "functional",
            "logic-state",
            "ux",
            "visual-ui",
            "responsive-cross-browser",
            "accessibility",
            "performance",
            "seo-content",
            "security-passive",
            "product",
            "content-i18n",
            "legal-ui"
          ]
        },
        "check_id": {
          "type": "string",
          "description": "id пункта чек-листа, например fn.broken-links, a11y.axe.color-contrast"
        },
        "type": {
          "enum": [
            "bug",
            "ux-issue",
            "a11y",
            "performance",
            "seo",
            "content",
            "security",
            "visual",
            "proposal",
            "suggestion",
            "user-story"
          ]
        },
        "severity": {
          "enum": [
            "critical",
            "high",
            "medium",
            "low",
            "info"
          ]
        },
        "title": {
          "type": "string",
          "maxLength": 120,
          "description": "Что не так и где, без оценок: «Поиск: пустой результат при запросе с пробелом в конце»"
        },
        "url": {
          "type": "string"
        },
        "element": {
          "type": [
            "string",
            "null"
          ],
          "description": "Стабильный локатор: role+name или CSS без nth-child"
        },
        "steps": {
          "type": "array",
          "items": {
            "type": "string"
          },
          "description": "Шаги воспроизведения с начала (с URL)"
        },
        "expected": {
          "type": "string"
        },
        "actual": {
          "type": "string"
        },
        "environment": {
          "type": "object",
          "properties": {
            "browser": {
              "type": "string"
            },
            "browser_version": {
              "type": "string"
            },
            "viewport": {
              "type": "string",
              "description": "WxH"
            },
            "os": {
              "type": "string"
            },
            "auth": {
              "enum": [
                "none",
                "test-account",
                "manual"
              ]
            },
            "date": {
              "type": "string"
            }
          }
        },
        "environment_list": {
          "type": "array",
          "items": {
            "type": "string"
          },
          "description": "Все окружения, где воспроизводится: chromium@375x812 …"
        },
        "screenshots": {
          "type": "array",
          "items": {
            "type": "string"
          },
          "description": "Пути относительно папки прогона"
        },
        "console": {
          "type": "array",
          "items": {
            "type": "string"
          },
          "description": "Релевантные сообщения консоли (замаскированные)"
        },
        "network": {
          "type": "array",
          "items": {
            "type": "object",
            "properties": {
              "url": {
                "type": "string"
              },
              "method": {
                "type": "string"
              },
              "status": {
                "type": "integer"
              }
            }
          }
        },
        "evidence": {
          "type": "object",
          "description": "Направленческие данные: axe rule/nodes, метрики Lighthouse, заголовки и т.п."
        },
        "hypothesis": {
          "type": "string",
          "description": "Гипотеза причины (без доступа к коду — помечать как гипотезу)"
        },
        "suggestion": {
          "type": "string",
          "description": "Предложение по исправлению/улучшению"
        },
        "priority": {
          "enum": [
            "quick-win",
            "major-project",
            "fill-in",
            "thankless",
            null
          ],
          "description": "Для product: матрица эффект/усилия"
        },
        "sources": {
          "type": "array",
          "items": {
            "type": "string"
          },
          "description": "own:checklist | own:script:<name> | plugin:<name>"
        },
        "merged_ids": {
          "type": "array",
          "items": {
            "type": "string"
          }
        },
        "status": {
          "enum": [
            "NEW",
            "DUPLICATE-OPEN",
            "FIXED-OK",
            "FIXED-INSUFFICIENT",
            "REGRESSION",
            "ALREADY-COPIED",
            "UNSURE-MATCH",
            "NOT-CHECKED",
            null
          ]
        },
        "status_reason": {
          "type": "string",
          "description": "Почему такой статус; для FIXED-INSUFFICIENT — чего не хватает в исправлении"
        },
        "not_checked_reason": {
          "enum": [
            "logout-required",
            "other-account-type",
            "forbidden",
            "steps-unclear",
            "environment",
            "other",
            null
          ],
          "description": "Для status NOT-CHECKED: нужен выход из аккаунта / нужен другой тип аккаунта / запрет / шаги неясны / окружение / другое; подробности — в status_reason"
        },
        "frequency": {
          "enum": [
            "always",
            "sometimes",
            "once",
            null
          ],
          "description": "Как часто воспроизводится: всегда / иногда / один раз"
        },
        "account_state": {
          "type": [
            "string",
            "null"
          ],
          "description": "Состояние аккаунта при воспроизведении: guest, free (без Pro), pro (с Pro) или своё значение из run-config"
        },
        "platform": {
          "type": [
            "string",
            "null"
          ],
          "description": "Платформа: desktop, mobile, tablet, ios, android, landscape…"
        },
        "claim_ref": {
          "type": "object",
          "required": [
            "repo",
            "number"
          ],
          "description": "Заявленное исправление, которое перепроверяет находка (scripts/claims.py)",
          "properties": {
            "repo": {
              "type": "string"
            },
            "number": {
              "type": "integer"
            },
            "quote": {
              "type": "string",
              "description": "Цитата заявления владельца"
            },
            "url": {
              "type": "string"
            },
            "version": {
              "type": [
                "string",
                "null"
              ]
            }
          }
        },
        "triage": {
          "type": "object",
          "description": "Оценка из внешней системы (с оговоркой, не замена своей severity)",
          "properties": {
            "severity": {
              "type": "string"
            },
            "confidence": {
              "type": [
                "number",
                "string"
              ]
            },
            "kind": {
              "type": "string"
            },
            "note": {
              "type": "string"
            },
            "source": {
              "type": "string"
            }
          }
        },
        "target_forms": {
          "type": "object",
          "description": "Поля формы целевого репозитория: {\"owner/repo\": {\"area\": \"…\", \"severity_label\": \"…\"}}",
          "additionalProperties": {
            "type": "object",
            "properties": {
              "area": {
                "type": "string"
              },
              "severity_label": {
                "type": "string"
              },
              "template": {
                "type": "string"
              }
            }
          }
        },
        "matches": {
          "type": "array",
          "items": {
            "type": "object",
            "properties": {
              "repo": {
                "type": "string"
              },
              "number": {
                "type": "integer"
              },
              "url": {
                "type": "string"
              },
              "how": {
                "enum": [
                  "marker",
                  "fuzzy",
                  "manual"
                ]
              }
            }
          }
        },
        "question": {
          "type": [
            "string",
            "null"
          ],
          "description": "Открытый вопрос пользователю (баг или задумано и т.п.)"
        },
        "published": {
          "type": "array",
          "items": {
            "type": "object",
            "properties": {
              "repo": {
                "type": "string"
              },
              "number": {
                "type": "integer"
              },
              "url": {
                "type": "string"
              },
              "kind": {
                "enum": [
                  "issue",
                  "comment",
                  "draft"
                ]
              }
            }
          }
        },
        "related": {
          "type": "array",
          "items": {
            "type": "string"
          },
          "description": "id связанных находок (для proposal/user-story — основание)"
        },
        "repro": {
          "type": "object",
          "description": "Как перезапустить измерение одной командой (recheck.py): {url, js | selector [+assert], device?, size?, locale?, setup?} или {argv | cmd, expect?, expect_exit?}; только скрипты скила",
          "properties": {
            "url": {"type": "string"},
            "js": {"type": "string", "description": "выражение в странице: true, если дефект есть"},
            "selector": {"type": "string"},
            "assert": {"type": "string", "description": "выражение над рамкой b {x, y, w, h}: true, если дефект есть"},
            "device": {"type": "string"},
            "size": {"type": "string"},
            "locale": {"type": "string"},
            "setup": {"type": "string"},
            "argv": {"type": "array", "items": {"type": "string"}},
            "cmd": {"type": "string"},
            "expect": {"type": "string"},
            "expect_exit": {"type": "integer"},
            "note": {"type": "string"}
          }
        },
        "recheck": {
          "type": "object",
          "description": "Независимая перепроверка перед публикацией (recheck.py run/set)",
          "properties": {
            "status": {"enum": ["confirmed", "flaky", "not-reproduced", "error", "refused", "no-repro", "planned"]},
            "by": {"type": "string"},
            "at": {"type": "string"},
            "independent": {"type": "boolean"},
            "manual": {"type": "boolean"},
            "runs": {"type": "array"},
            "reason": {"type": "string"},
            "note": {"type": "string"}
          }
        },
        "legal": {
          "type": "object",
          "description": "Правовые и финансовые утверждения: только с второй проверкой другим исполнителем и пометкой «проверить юристом»",
          "properties": {
            "claims_law": {"type": "boolean"},
            "norms": {"type": "array", "items": {"type": "string"}},
            "jurisdictions": {"type": "array", "items": {"type": "string"}},
            "second_check": {
              "type": "object",
              "properties": {
                "by": {"type": "string"},
                "result": {"enum": ["confirmed", "corrected", "rejected"]},
                "at": {"type": "string"},
                "note": {"type": "string"}
              }
            },
            "lawyer_review": {"type": "boolean"}
          }
        },
        "ingested": {
          "type": "object",
          "description": "Откуда пришла находка (ingest_findings.py): поток и время"
        },
        "source_id": {
          "type": "string",
          "description": "id находки у исполнителя (до присвоения F-NNN)"
        }
      },
      "if": {
        "properties": {
          "type": {
            "enum": [
              "proposal",
              "user-story"
            ]
          }
        }
      },
      "else": {
        "required": [
          "actual"
        ]
      },
      "description": "Находка. actual обязателен для всех типов, кроме proposal и user-story."
    }
  }
}
